{"document_id":"QPS_SSOT_VIEW_BUILD_RECEIPT","source_sha256":"d012ac1313df9a2dff4cc838f2e05f70699052587b0979046a2a58528e97b7fb","row_count":449,"outputs":["QPS_LKT_NEGO_RFI_COMPLIANCE_SSOT_v1.0.xlsx","QPS_LKT_NEGO_RFI_COMPLIANCE_SSOT_v1.0.html","QPS_LKT_NEGO_RFI_COMPLIANCE_SSOT_v1.0_management.pptx","QPS_LKT_NEGO_RFI_COMPLIANCE_SSOT_v1.0_management.pdf"],"style_contract":{"font_family":"Aptos","palette_source":"GBOGEB/ABACUS:ssot/ssot_style.json","legend_parity":true,"visual_qa_required":true},"semantic_guardrails":{"deviation_not_nok":true,"partial_supported_residual":true,"reviewed_not_compliant":true,"promised_not_verified":true},"visual_qa":{"playwright":"PASS","excel_render":"PASS","ppt_render":"PASS","pdf_render":"PASS","cross_format_parity":"PASS"},"formal_credit":0}
