{
  "document_id": "QPS_SSOT_VIEW_BUILD_RECEIPT",
  "source_sha256": "f314f09ddc286d27fa2619245de06f5f422a3428ea50ee286a453d8c47717738",
  "row_count": 449,
  "outputs": [
    "QPS_LKT_NEGO_RFI_COMPLIANCE_SSOT_v1.2.xlsx",
    "QPS_LKT_NEGO_RFI_COMPLIANCE_SSOT_v1.2.html",
    "QPS_LKT_NEGO_RFI_COMPLIANCE_SSOT_v1.2_management.pptx",
    "QPS_LKT_NEGO_RFI_COMPLIANCE_SSOT_v1.2_management.pdf",
    "QPS_CANONICAL_OUTWARD_INDEX_v1.2.html"
  ],
  "style_contract": {
    "font_family": "Aptos",
    "palette_source": "ABACUS ssot/ssot_style.json",
    "legend_parity": true,
    "visual_qa_required": true
  },
  "semantic_guardrails": {
    "deviation_not_nok": true,
    "partial_supported_residual": true,
    "reviewed_not_compliant": true,
    "promised_not_verified": true
  },
  "visual_qa": {
    "playwright": "PASS",
    "excel_render": "PASS",
    "ppt_render": "PASS",
    "pdf_render": "PASS",
    "cross_format_parity": "PASS"
  },
  "formal_credit": 0
}
